[
  {
    "schema_version": "1.0",
    "record": {
      "source_file": "001_佛山市亮正新材料有限公司新建项目_01_核查材料.docx",
      "relative_path": "环评报告文件_按问答顺序\\001_佛山市亮正新材料有限公司新建项目_01_核查材料.docx",
      "project_name": "佛山市亮正新材料有限公司新建项目",
      "version_round": "01_核查材料"
    },
    "question": {
      "question_text": "请根据项目最终产品、主要原辅材料、核心生产工艺、产品用途及主要活动证据，判断报告填报的国民经济行业类别是否正确，并说明依据。"
    },
    "source_extraction": {
      "reported_industry_classifications": [
        {
          "raw_text": "C2223 加工纸制造；C2921塑料薄膜制造",
          "display_code": "C2223",
          "numeric_code": "2223",
          "name": "加工纸制造",
          "source_location": {
            "section": "一、建设项目基本情况",
            "subsection": null,
            "table_number": null,
            "table_name": "基本情况表",
            "field_name": "国民经济行业类别",
            "page": null
          },
          "evidence_id": "E1-1"
        },
        {
          "raw_text": "C2223 加工纸制造；C2921塑料薄膜制造",
          "display_code": "C2921",
          "numeric_code": "2921",
          "name": "塑料薄膜制造",
          "source_location": {
            "section": "一、建设项目基本情况",
            "subsection": null,
            "table_number": null,
            "table_name": "基本情况表",
            "field_name": "国民经济行业类别",
            "page": null
          },
          "evidence_id": "E1-2"
        }
      ],
      "products": [
        {
          "product_name": "保护纸",
          "product_remark": null,
          "capacity": 400,
          "unit": "万米/年",
          "external_sale": null,
          "source_location": {
            "section": "二、建设项目工程分析",
            "subsection": null,
            "table_number": null,
            "table_name": "主要产品及产能/项目概况",
            "field_name": "产品及产能",
            "page": null
          },
          "evidence_id": "E2-1"
        },
        {
          "product_name": "保护膜",
          "product_remark": null,
          "capacity": 200,
          "unit": "万米/年",
          "external_sale": null,
          "source_location": {
            "section": "二、建设项目工程分析",
            "subsection": null,
            "table_number": null,
            "table_name": "主要产品及产能/项目概况",
            "field_name": "产品及产能",
            "page": null
          },
          "evidence_id": "E2-2"
        }
      ],
      "materials": [
        {
          "material_name": "牛皮纸",
          "source_location": {
            "section": "二、建设项目工程分析",
            "subsection": null,
            "table_number": null,
            "table_name": "主要原辅材料及年用量",
            "field_name": "物料名称",
            "page": null
          },
          "evidence_id": "E3-1"
        },
        {
          "material_name": "水性丙烯酸酯压敏胶",
          "source_location": {
            "section": "二、建设项目工程分析",
            "subsection": null,
            "table_number": null,
            "table_name": "主要原辅材料及年用量",
            "field_name": "物料名称",
            "page": null
          },
          "evidence_id": "E3-2"
        },
        {
          "material_name": "合成硅油309",
          "source_location": {
            "section": "二、建设项目工程分析",
            "subsection": null,
            "table_number": null,
            "table_name": "主要原辅材料及年用量",
            "field_name": "物料名称",
            "page": null
          },
          "evidence_id": "E3-3"
        },
        {
          "material_name": "保护膜原膜（PE）",
          "source_location": {
            "section": "二、建设项目工程分析",
            "subsection": null,
            "table_number": null,
            "table_name": "主要原辅材料及年用量",
            "field_name": "物料名称",
            "page": null
          },
          "evidence_id": "E3-4"
        },
        {
          "material_name": "浓缩高氨天然乳胶",
          "source_location": {
            "section": "二、建设项目工程分析",
            "subsection": null,
            "table_number": null,
            "table_name": "主要原辅材料及年用量",
            "field_name": "物料名称",
            "page": null
          },
          "evidence_id": "E3-5"
        },
        {
          "material_name": "液体萜烯树脂",
          "source_location": {
            "section": "二、建设项目工程分析",
            "subsection": null,
            "table_number": null,
            "table_name": "主要原辅材料及年用量",
            "field_name": "物料名称",
            "page": null
          },
          "evidence_id": "E3-6"
        }
      ],
      "production_processes": [
        {
          "process_name": "保护纸：调胶、上胶、复合熟化、印刷、收卷打包",
          "raw_basis": "水性丙烯酸酯压敏胶和合成硅油309调胶；牛皮纸上胶；复合熟化100℃；水墨印刷；收卷打包形成成品。",
          "source_location": {
            "section": "二、建设项目工程分析",
            "subsection": null,
            "table_number": null,
            "table_name": "工艺流程和产排污环节",
            "field_name": "工艺流程简述",
            "page": null
          },
          "evidence_ids": [
            "E4-1"
          ]
        },
        {
          "process_name": "保护膜：调胶、上胶、复合熟化、收卷打包",
          "raw_basis": "浓缩高氨天然乳胶和液体萜烯树脂调胶；保护膜原膜（PE）上胶；复合熟化80℃；收卷打包形成成品。",
          "source_location": {
            "section": "二、建设项目工程分析",
            "subsection": null,
            "table_number": null,
            "table_name": "工艺流程和产排污环节",
            "field_name": "工艺流程简述",
            "page": null
          },
          "evidence_ids": [
            "E4-2"
          ]
        }
      ],
      "product_uses": [
        {
          "product_name": "保护纸",
          "use_text": "表面保护",
          "is_explicit": true,
          "source_location": {
            "section": "二、建设项目工程分析",
            "subsection": null,
            "table_number": null,
            "table_name": "项目概况/产品备注/工艺说明",
            "field_name": "产品用途",
            "page": null
          },
          "evidence_id": "E5-1"
        },
        {
          "product_name": "保护膜",
          "use_text": "表面保护",
          "is_explicit": true,
          "source_location": {
            "section": "二、建设项目工程分析",
            "subsection": null,
            "table_number": null,
            "table_name": "项目概况/产品备注/工艺说明",
            "field_name": "产品用途",
            "page": null
          },
          "evidence_id": "E5-2"
        }
      ],
      "main_activity_evidence": [
        {
          "metric": "未提供",
          "activity_name": null,
          "value": null,
          "unit": null,
          "source_location": {
            "section": "二、建设项目工程分析",
            "subsection": null,
            "table_number": null,
            "table_name": null,
            "field_name": "增加值/销售收入/营业收入/从业人员",
            "page": null
          },
          "evidence_id": "E6"
        }
      ]
    },
    "evidence_chain": [
      {
        "evidence_id": "E1-1",
        "evidence_type": "填报行业",
        "status": "found",
        "source_file": "001_佛山市亮正新材料有限公司新建项目_01_核查材料.docx",
        "source_location": {
          "section": "一、建设项目基本情况",
          "subsection": null,
          "table_number": null,
          "table_name": "基本情况表",
          "field_name": "国民经济行业类别",
          "page": null
        },
        "quote": "国民经济行业类别：C2223 加工纸制造；C2921塑料薄膜制造"
      },
      {
        "evidence_id": "E2-1",
        "evidence_type": "最终产品",
        "status": "found",
        "source_file": "001_佛山市亮正新材料有限公司新建项目_01_核查材料.docx",
        "source_location": {
          "section": "二、建设项目工程分析",
          "subsection": null,
          "table_number": "表2-2",
          "table_name": "变更前后项目基本情况一览表",
          "field_name": "产品及产能",
          "page": null
        },
        "quote": "主要从事纸制品制造，年产保护纸400万米、保护膜200万米。"
      },
      {
        "evidence_id": "E3-1",
        "evidence_type": "主要原料",
        "status": "found",
        "source_file": "001_佛山市亮正新材料有限公司新建项目_01_核查材料.docx",
        "source_location": {
          "section": "二、建设项目工程分析",
          "subsection": null,
          "table_number": "表2-4",
          "table_name": "项目主要原辅材料及年用量情况",
          "field_name": "物料名称",
          "page": null
        },
        "quote": "保护纸使用水性丙烯酸酯压敏胶和硅油；保护膜使用天然乳胶和液体萜烯树脂；工艺说明列明牛皮纸、保护膜原膜（PE）。"
      },
      {
        "evidence_id": "E4-1",
        "evidence_type": "核心工艺",
        "status": "found",
        "source_file": "001_佛山市亮正新材料有限公司新建项目_01_核查材料.docx",
        "source_location": {
          "section": "二、建设项目工程分析",
          "subsection": null,
          "table_number": null,
          "table_name": "工艺流程和产排污环节",
          "field_name": "工艺流程简述",
          "page": null
        },
        "quote": "保护纸经调胶、牛皮纸上胶、复合熟化、水墨印刷、收卷打包；保护膜经调胶、PE原膜上胶、复合熟化、收卷打包。"
      },
      {
        "evidence_id": "E5-1",
        "evidence_type": "产品用途",
        "status": "found",
        "source_file": "001_佛山市亮正新材料有限公司新建项目_01_核查材料.docx",
        "source_location": {
          "section": "二、建设项目工程分析",
          "subsection": null,
          "table_number": null,
          "table_name": "工艺说明/产品名称",
          "field_name": "产品用途",
          "page": null
        },
        "quote": "产品名称为保护纸、保护膜，工艺说明显示按客户定制图标并形成成品，初步理解为表面保护用途。"
      },
      {
        "evidence_id": "E6",
        "evidence_type": "主要活动",
        "status": "missing",
        "source_file": "001_佛山市亮正新材料有限公司新建项目_01_核查材料.docx",
        "source_location": {
          "section": "二、建设项目工程分析",
          "subsection": null,
          "table_number": null,
          "table_name": null,
          "field_name": "增加值/销售收入/营业收入/从业人员",
          "page": null
        },
        "quote": null
      },
      {
        "evidence_id": "E7-1",
        "evidence_type": "官方分类依据",
        "status": "found",
        "source_file": "2017国民经济行业分类注释_按第1号修改单修订.xlsx",
        "source_location": {
          "section": "国家统计局国民经济行业分类注释",
          "subsection": null,
          "table_number": null,
          "table_name": "小类注释",
          "field_name": "C2223",
          "page": null
        },
        "quote": "C2223加工纸制造：指对原纸及纸板进一步加工的生产活动；包括涂布浸渍覆盖纸、塑料涂布、浸渍或覆盖纸及纸板、其他加工纸。 来源：国家统计局《2017国民经济行业分类注释》（按第1号修改单修订），https://www.stats.gov.cn/sj/tjbz/gmjjhyfl/"
      },
      {
        "evidence_id": "E7-2",
        "evidence_type": "官方分类依据",
        "status": "found",